{"iteration": 0, "low": 0.3, "high": 0.7, "covered_ba": 0.5725, "coverage": 0.75, "delta": 0.0, "status": "baseline", "timestamp": "2026-04-13T21:33:32.698291+00:00"}
{"iteration": 1, "low": 0.2, "high": 0.8, "covered_ba": 0.5, "coverage": 0.5833, "delta": -0.0725, "status": "discard", "timestamp": "2026-04-13T21:33:33.714059+00:00"}
{"iteration": 2, "low": 0.25, "high": 0.75, "covered_ba": 0.4886, "coverage": 0.6786, "delta": -0.0839, "status": "discard", "timestamp": "2026-04-13T21:33:34.684761+00:00"}
{"iteration": 3, "low": 0.2, "high": 0.75, "covered_ba": 0.4868, "coverage": 0.5952, "delta": -0.0857, "status": "discard", "timestamp": "2026-04-13T21:33:35.699581+00:00"}
{"iteration": 4, "low": 0.15, "high": 0.8, "covered_ba": 0.5, "coverage": 0.3929, "delta": -0.0725, "status": "discard", "timestamp": "2026-04-13T21:33:36.686648+00:00"}
{"iteration": 5, "low": 0.25, "high": 0.7, "covered_ba": 0.5715, "coverage": 0.7262, "delta": -0.001, "status": "discard", "timestamp": "2026-04-13T21:33:37.670724+00:00"}
{"iteration": 6, "low": 0.2, "high": 0.7, "covered_ba": 0.5744, "coverage": 0.6429, "delta": 0.0019, "status": "keep", "timestamp": "2026-04-13T21:33:38.659064+00:00"}
{"iteration": 7, "low": 0.15, "high": 0.7, "covered_ba": 0.6322, "coverage": 0.4524, "delta": 0.0597, "status": "keep", "timestamp": "2026-04-13T21:33:39.658681+00:00"}
{"iteration": 8, "low": 0.1, "high": 0.7, "covered_ba": 0.6974, "coverage": 0.2976, "delta": 0.1249, "status": "keep", "timestamp": "2026-04-13T21:33:40.695345+00:00"}
{"iteration": 9, "low": 0.3, "high": 0.75, "covered_ba": 0.4891, "coverage": 0.7024, "delta": -0.0834, "status": "discard", "timestamp": "2026-04-13T21:33:41.700694+00:00"}
{"iteration": 10, "low": 0.3, "high": 0.8, "covered_ba": 0.5, "coverage": 0.6905, "delta": -0.0725, "status": "discard", "timestamp": "2026-04-13T21:33:42.709150+00:00"}
{"iteration": 11, "low": 0.3, "high": 0.85, "covered_ba": 0.5, "coverage": 0.6905, "delta": -0.0725, "status": "discard", "timestamp": "2026-04-13T21:33:43.708807+00:00"}
{"iteration": 12, "low": 0.3, "high": 0.9, "covered_ba": 0.5, "coverage": 0.6905, "delta": -0.0725, "status": "discard", "timestamp": "2026-04-13T21:33:44.762724+00:00"}
{"iteration": 13, "low": 0.1, "high": 0.75, "covered_ba": 0.4722, "coverage": 0.25, "delta": -0.1003, "status": "discard", "timestamp": "2026-04-13T21:33:45.774443+00:00"}
{"iteration": 14, "low": 0.1, "high": 0.8, "covered_ba": 0.5, "coverage": 0.2381, "delta": -0.0725, "status": "discard", "timestamp": "2026-04-13T21:33:46.787192+00:00"}
{"iteration": 15, "low": 0.1, "high": 0.85, "covered_ba": 0.5, "coverage": 0.2381, "delta": -0.0725, "status": "discard", "timestamp": "2026-04-13T21:33:47.845455+00:00"}
{"iteration": 16, "low": 0.1, "high": 0.9, "covered_ba": 0.5, "coverage": 0.2381, "delta": -0.0725, "status": "discard", "timestamp": "2026-04-13T21:33:48.841788+00:00"}
{"iteration": 17, "low": 0.15, "high": 0.75, "covered_ba": 0.4821, "coverage": 0.4048, "delta": -0.0904, "status": "discard", "timestamp": "2026-04-13T21:33:49.858257+00:00"}
{"iteration": 18, "low": 0.15, "high": 0.85, "covered_ba": 0.5, "coverage": 0.3929, "delta": -0.0725, "status": "discard", "timestamp": "2026-04-13T21:33:50.849994+00:00"}
{"iteration": 19, "low": 0.15, "high": 0.9, "covered_ba": 0.5, "coverage": 0.3929, "delta": -0.0725, "status": "discard", "timestamp": "2026-04-13T21:33:51.853981+00:00"}
{"iteration": 20, "low": 0.2, "high": 0.85, "covered_ba": 0.5, "coverage": 0.5833, "delta": -0.0725, "status": "discard", "timestamp": "2026-04-13T21:33:52.895754+00:00"}
{"iteration": 21, "low": 0.2, "high": 0.9, "covered_ba": 0.5, "coverage": 0.5833, "delta": -0.0725, "status": "discard", "timestamp": "2026-04-13T21:33:54.005709+00:00"}
{"iteration": 22, "low": 0.25, "high": 0.8, "covered_ba": 0.5, "coverage": 0.6667, "delta": -0.0725, "status": "discard", "timestamp": "2026-04-13T21:33:55.008707+00:00"}
{"iteration": 23, "low": 0.25, "high": 0.85, "covered_ba": 0.5, "coverage": 0.6667, "delta": -0.0725, "status": "discard", "timestamp": "2026-04-13T21:33:56.001509+00:00"}
{"iteration": 24, "low": 0.25, "high": 0.9, "covered_ba": 0.5, "coverage": 0.6667, "delta": -0.0725, "status": "discard", "timestamp": "2026-04-13T21:33:56.963437+00:00"}
{"iteration": 25, "low": 0.35, "high": 0.7, "covered_ba": 0.5733, "coverage": 0.7738, "delta": 0.0008, "status": "discard", "timestamp": "2026-04-13T21:33:57.935218+00:00"}
{"iteration": 26, "low": 0.35, "high": 0.75, "covered_ba": 0.4896, "coverage": 0.7262, "delta": -0.0829, "status": "discard", "timestamp": "2026-04-13T21:33:58.936199+00:00"}
{"iteration": 27, "low": 0.35, "high": 0.8, "covered_ba": 0.5, "coverage": 0.7143, "delta": -0.0725, "status": "discard", "timestamp": "2026-04-13T21:33:59.935588+00:00"}
{"iteration": 28, "low": 0.35, "high": 0.85, "covered_ba": 0.5, "coverage": 0.7143, "delta": -0.0725, "status": "discard", "timestamp": "2026-04-13T21:34:00.941768+00:00"}
{"iteration": 29, "low": 0.35, "high": 0.9, "covered_ba": 0.5, "coverage": 0.7143, "delta": -0.0725, "status": "discard", "timestamp": "2026-04-13T21:34:01.952704+00:00"}
{"iteration": 30, "low": 0.4, "high": 0.7, "covered_ba": 0.5752, "coverage": 0.8333, "delta": 0.0027, "status": "discard", "timestamp": "2026-04-13T21:34:02.958542+00:00"}
{"iteration": 31, "low": 0.4, "high": 0.75, "covered_ba": 0.4906, "coverage": 0.7857, "delta": -0.0819, "status": "discard", "timestamp": "2026-04-13T21:34:03.969262+00:00"}
{"iteration": 32, "low": 0.4, "high": 0.8, "covered_ba": 0.5, "coverage": 0.7738, "delta": -0.0725, "status": "discard", "timestamp": "2026-04-13T21:34:04.992879+00:00"}
{"iteration": 33, "low": 0.4, "high": 0.85, "covered_ba": 0.5, "coverage": 0.7738, "delta": -0.0725, "status": "discard", "timestamp": "2026-04-13T21:34:06.130833+00:00"}
{"iteration": 34, "low": 0.4, "high": 0.9, "covered_ba": 0.5, "coverage": 0.7738, "delta": -0.0725, "status": "discard", "timestamp": "2026-04-13T21:34:07.172930+00:00"}
{"iteration": 35, "low": 0.45, "high": 0.7, "covered_ba": 0.5756, "coverage": 0.8452, "delta": 0.0031, "status": "discard", "timestamp": "2026-04-13T21:34:08.148014+00:00"}
{"iteration": 36, "low": 0.45, "high": 0.75, "covered_ba": 0.4907, "coverage": 0.7976, "delta": -0.0818, "status": "discard", "timestamp": "2026-04-13T21:34:09.177485+00:00"}
{"iteration": 37, "low": 0.45, "high": 0.8, "covered_ba": 0.5, "coverage": 0.7857, "delta": -0.0725, "status": "discard", "timestamp": "2026-04-13T21:34:10.322794+00:00"}
{"iteration": 38, "low": 0.45, "high": 0.85, "covered_ba": 0.5, "coverage": 0.7857, "delta": -0.0725, "status": "discard", "timestamp": "2026-04-13T21:34:11.337395+00:00"}
{"iteration": 39, "low": 0.45, "high": 0.9, "covered_ba": 0.5, "coverage": 0.7857, "delta": -0.0725, "status": "discard", "timestamp": "2026-04-13T21:34:12.342805+00:00"}
{"iteration": 40, "low": 0.3, "high": 0.65, "covered_ba": 0.6176, "coverage": 0.7738, "delta": 0.0451, "status": "discard", "timestamp": "2026-04-13T21:34:13.351658+00:00"}
{"iteration": 41, "low": 0.1, "high": 0.55, "covered_ba": 0.7548, "coverage": 0.369, "delta": 0.1823, "status": "keep", "timestamp": "2026-04-13T21:34:14.353191+00:00"}
